Letter,Title,Description
C,Cipolla dorata,"La cipolla dorata, anche detta ramata, è una varietà molto versatile che, durante la cottura, tende ad addolcirsi e ammorbidirsi. Ne ..."
C,Cipolla in polvere,"Cipolla in polvere, caratteristiche principali
La cipolla in polvere è un ingrediente che solitamente viene usato come condimento in ..."
C,Cipolla rosa toscana,"Cipolla rosa toscana, proprietà principali
La cipolla rosa toscana è una varietà di cipolla con bulbo rosso brillante dal sapore dolce ..."
C,Cipolla rossa,"La cipolla rossa è un ortaggio dal nome scientifico Allium Cepa. Fa dunque parte della famiglia dell’erba cipollina, dell’aglio, dello ..."
C,Cipolla rossa di Tropea,"Cipolla rossa di Tropea, proprietà principali
La cipolla rossa di Tropea appartiene alla famiglia delle Liliacee; ha una forma tonda o ..."
C,Cipolline,Le cipolline sono facilmente riconoscibili per le loro dimensioni e la loro forma leggermente schiacciata. Molto diffuse nella dieta ...
C,Cipolline borettane,"Le cipolline borettane sono un ingrediente delizioso, originario della città di Boretto, in provincia di Reggio Emilia. Dal gusto ..."
C,Cipolline d'Ivrea,"Cipolline d’Ivrea, caratteristiche principali
Le cipolline d’Ivrea sono un tipo di cipolla di dimensioni molto piccole, il loro ..."
C,Cipolline novelle,Le cipolline novelle sono degli ingredienti deliziosi utilizzati per la preparazione di tantissimi piatti a base di carne o di pesce. ...
C,Cipolline sott'aceto,"Le cipolline sott’aceto si chiamano anche borettane, dal nome della località originaria: Boretto, in provincia di Reggio Emilia. Si ..."
C,Cipollotto,"Più delicato delle cipolle e con una consistenza più morbida, il cipollotto è una cipolla non ancora giunta a completa ..."
C,Citronella (lemongrass),"Impossibile rimanere indifferenti davanti al profumo della citronella, o lemongrass che dir si voglia. La cumbopogon citratus è una ..."
C,Citronella in polvere,"Citronella in polvere, caratteristiche principali
La citronella, detta anche lemongrass, è un’erba originaria dell’India e che trova ..."
C,Clementine,"Clementine, proprietà principali
La clementina, conosciuta anche come mandarancio, nasce dall’incrocio del mandarino con l’arancia; a ..."
C,Coca Cola,"La Coca Cola è riconoscibilissima. Di colore scuro, simile al caffè, è frizzante e ha un gusto inconfondibile. La sua ricetta è molto ..."
C,Cocco,"Cocco, proprietà principali
La noce di cocco è il frutto della palma da cocco, che si distingue da quella delle banane e dei datteri ..."
C,Cocco rapè,"Cocco rapè, caratteristiche principali
Il cocco rapè, come la farina di cocco, si ricava dalla polpa del frutto disidratata. A ..."
C,Coda di bue,"Coda di bue, caratteristiche principali
La coda di bue non è altro che la coda del bovino, che rimane attaccata all’osso sacro ..."
C,Coda di manzo,"Coda di manzo, proprietà principali
La coda di manzo è una delle parti del cosiddetto quinto quarto del bovino, ovvero ciò che resta ..."
C,Code di gamberetti,"Code di gamberetti, caratteristiche principali
Le code di gamberetti, proprio come i gamberi, fanno parte della famiglia dei Decapodi. ..."
C,Code di gamberi,"Perfette per la preparazione di primi piatti e risotto, superlative se cucinate in padella o alla griglia, le code di gamberi sono le ..."
C,Code di gamberoni,"Le code di gamberoni sono un ingrediente molto versatile, che può essere utilizzato in tantissime ricette. Da gustare da sole o per ..."
C,Code di scampi,"Code di scampi, caratteristiche principali
Le code di scampi rappresentano la parte finale dello scampo, conosciuto con il nome ..."
C,Codette,"Le codette, conosciute anche come codette arcobaleno o multicolore, sono le protagoniste assolute di tutte le ricette dolciarie della ..."
C,Cognac,Il cognac è un distillato francese che è tutelato da una Appellation d’origine contrôlée (AOC). Viene ricavato dalla distillazione del ...
C,Cognac al mandarino,"Cognac al mandarino, caratteristiche principali
Il Cognac al mandarino unisce l’eleganza degli aromi tipici di quello tradizionale a ..."
C,Cointreau,Il Cointreau è un liquore classico prodotto tramite la macerazione di arance amare in alcol: è il triple sec francese più famoso del ...
C,Colatura di alici,"Colatura di alici, caratteristiche principali
La colatura di alici è una salsa trasparente di colore ambrato più o meno scuro, ottenuta ..."
C,Colomba,La colomba è uno dei dolci pasquali più amati nel nostro Paese. Si tratta di un evergreen che non manca mai in tavola durante le ...
C,Colorante alimentare blu,"Può capitare, soprattutto in pasticceria, di trovare alimenti dal vivido colore blu. Queste sfumature vengono raggiunte solo grazie ..."
C,Colorante alimentare di vari colori,"I coloranti alimentari non sono alimenti bensì sostanze senza alcun valore nutritivo, o comunque utilizzate per fini non nutritivi, ..."
C,Colorante alimentare giallo,"Colorante alimentare giallo, caratteristiche principali
I coloranti alimentari sono additivi e vengono utilizzati insieme ad altri ..."
C,Colorante alimentare nero,"I coloranti alimentari sono additivi, ovvero sostanze che vengono aggiunte a determinati cibi per dare loro un colore particolare. ..."
C,Colorante alimentare rosso,"I coloranti alimentari sono molto utilizzati soprattutto in pasticceria, per dare un tocco più originale a torte e dessert. Uno dei più ..."
C,Colorante alimentare verde,Il colorante alimentare verde è fra i colori più diffusi in cucina o per la produzione di pasta fresca. Il verde è apprezzato nella ...
C,Composta di albicocche,"La composta di albicocca è una conserva di un frutto tipicamente estivo. Rispetto alle marmellate e alle confetture, questo tipo di ..."
C,Composta di mele,"La composta di mele è una conserva deliziosa, preparata con frutta fresca e cotta per pochi minuti, così da mantenere il più possibile ..."
C,Concentrato di pomodoro,Il concentrato di pomodoro è un prodotto derivato dalla lavorazione del pomodoro. L’ortaggio rosso viene sottoposto ad alcuni ...
C,Conchiglie rigate,"Ispirate al mare, le conchiglie rigate sono un formato di pasta corta originario della Campania molto amate e diffuse, al giorno ..."
C,Conchiglioni rigati,I conchiglioni rigati sono un formato di pasta dalla consistenza straordinaria e dal sapore unico di origine campana. Hanno una forma a ...
C,Confetti al cioccolato colorati,"Confetti al cioccolato colorati, proprietà principali
I confetti colorati al cioccolato sono dolci formati da una mandorla la quale ..."
C,Confettura ai frutti di bosco,La confettura ai frutti di bosco è un prodotto squisito derivante da un mix di frutti dalle molteplici proprietà. Per capire bene di ...
C,Confettura di Afrodite,
C,Confettura di Natale,"La confettura di Natale è un prodotto tipicamente invernale e viene realizzata con la frutta di stagione: mele, mirtilli, cranberries, ..."
C,Confettura di albicocche,"Confettura di albicocche, proprietà principali
La confettura di albicocche è un prodotto presente nelle dispense di tantissime ..."
C,Confettura di ciliegie,La confettura di ciliegie è una purea gelatinosa che si ottiene con la polpa e il succo di questi frutti rossi. Facile da stendere e ...
C,Confettura di fragole,Con confettura di fragole si indica la mescolanza che si ricava dalla lavorazione appunto delle fragole e che si conserva in vasetti di ...
C,Confettura di frutta,"Buone e genuine, le confetture di frutta sono perfette per una merenda, uno spuntino o da gustare spalmate sul pane a colazione. Facile ..."
C,Confettura di lamponi,"La confettura di lamponi è una conserva che si realizza con i caratteristici frutti di lampone, conosciuti per il loro sapore dolce e ..."
C,Confettura di peperoncino,"Confettura di peperoncino, proprietà principali
La confettura di peperoncino è un prodotto che affonda le sue radici nella tradizione ..."
C,Confettura di pere,"Per una prima colazione sana e diversa dal solito, la confettura di pere è proprio quello che ci vuole. Questo prodotto, meno celebre ..."
C,Confettura di pesche,Marmellate e confetture sono da sempre le protagoniste assolute della nostra cucina perché il loro impiego è davvero variegato e ...
C,Confettura di ribes,"Confettura di ribes, proprietà principali
Da consumare con il pane o sulle fette biscottate a colazione, da utilizzare per una crostata ..."
C,Coniglio,"Coniglio, proprietà principali
Come il pollo e il tacchino, il coniglio è considerato una carne bianca. In commercio si trova ..."
C,Controfiletto di manzo,"Controfiletto di manzo, proprietà principali
Il controfiletto di manzo è un taglio di carne molto apprezzato, di pregio leggermente ..."
C,Coppa,"Coppa, proprietà principali
La coppa è un salume pregiato ricavato da tagli scelti del maiale. In particolare si ottiene dal muscolo ..."
C,Coppa di Parma,La coppa di Parma è un salume insignito della denominazione IGP (Indicazione Geografica Protetta) dall’Unione Europea nel 2011. Si ...
C,Coriandolo,"Coriandolo, proprietà principali
Il coriandolo è una pianta spontanea alta da 45-60 cm ampiamente diffusa nell’Europa Meridionale, ..."
C,Coriandolo fresco,"Chiamato anche come prezzemolo cinese, il coriandolo fresco è una pianta aromatica appartenente alla famiglia del cumino, del finocchio ..."
C,Coriandolo in polvere,"Il coriandolo in polvere deriva dall’omonima pianta aromatica che appartiene alla famiglia delle Apiaceae, la stessa di cui fanno parte ..."
C,Corn flakes,"I tradizionali fiocchi di mais, usati generalmente per gustose colazioni leggere e nutrienti, ottimi nel latte, nello yogurt o immersi ..."
C,Corteccia di arancio amaro contusa,
C,Corzetti,"Dalla Liguria con furore, i corzetti, o croxetti, ma anche meno propriamente picetti, hanno un’origine antichissima e sono un piatto ..."
C,Cosce di pollo,"Le cosce di pollo sono uno dei tagli del volatile più utilizzati e amati in cucina. Essendo prelibate, si prestano alla preparazione di ..."
C,Cosce di rana,"Le cosce di rana sono un alimento che, nonostante sia interessante dal punto di vista nutritivo, è ancora poco diffuso in Italia. ..."
C,Cosce di tacchino,"Cosce di tacchino, caratteristiche principali
Le cosce di tacchino rappresentano il taglio più grasso dell’animale, soprattutto se sono ..."
C,Cosciotto d'agnello,"Cosciotto d’agnello, proprietà principali
La carne d’agnello e il cosciotto d’agnello si cucinano prevalentemente a Pasqua e spesso in ..."
C,Costata di manzo,"La costata di manzo è un taglio di carne molto apprezzato, un tipo di bistecca proveniente dal bovino maschio castrato e macellato tra ..."
C,Costine di maiale,"Costine di maiale, caratteristiche principali
Le costine di maiale, conosciute anche come puntine, spuntature o costoline, ..."
C,Costolette d'agnello,Le costolette d’agnello sono un prodotto alimentare molto apprezzato in cucina consumato soprattutto nel periodo pasquale. È ricavato ...
C,Costolette di vitello,"Le costolette di vitello, chiamate anche costine, sono un taglio di carne di bovino. La carne è particolarmente saporita e comprende la ..."
C,Cotechino,"Cotechino, proprietà principali
Il cotechino prende il nome dalla cotica, ossia la cotenna di maiale, che aggiunta a carne di prima ..."
C,Cotenna di maiale,"Cotenna di maiale, proprietà principali
Al pari di fegato e animelle, anche la cotenna di maiale rientra nel quinto taglio del maiale. ..."
C,Court-bouillon,Il brodo è una base fondamentale per le preparazioni in cucina. Il court bouillon è un brodo aromatico adatto alla cottura di pesci e ...
C,Couscous,"Couscous, proprietà principali
Il termine couscous, dall’arabo kuskusu, indica piccoli granelli di semola di grano duro cotto a vapore; ..."
C,Cozze,"Cozze, proprietà principali
Nota con i termini muscolo nelle regioni nord-occidentali italiane e peocio in quelle nord-orientali, la ..."
C,Cracker,"Cracker, proprietà principali
I cracker sono biscotti asciutti, croccanti e friabili. Di solito sono salati ma in commercio se ne ..."
C,Crauti,I crauti (in tedesco Sauerkraut) sono delle verdure ottenute dal cavolo cappuccio. Le foglie dell’ortaggio sono tagliate a piccole ...
C,Cream Whisky Devonshire,La Cream Whisky Devonshire è un liquore del Regno Unito che si ottiene con crema di latte e whisky della marca Devonshire. Il grado ...
C,Crema Baileys,"Crema Baileys, caratteristiche principali
La crema Baileys è un liquore a base di whiskey irlandese e crema di latte prodotto a Dublino ..."
C,Crema al pistacchio,"La crema al pistacchio è un ingrediente golosissimo, ottima da spalmare su una fetta di pane ma anche per preparare e farcire dolci, ..."
C,Crema di anacardi,"Crema di anacardi, caratteristiche principali
La crema di anacardi è una preparazione molto gustosa che trova ampio utilizzo in cucina ..."
C,Crema di banana,"Crema di banana, caratteristiche principali
La crema di banana si ottiene frullando il frutto, con un cucchiaio di ghiaccio tritato e ..."
C,Crema di cacao bianca,"La crema di cacao bianca è, per l’appunto, bianca con dei riflessi che tendono al giallo quasi impercettibili. È caratterizzata da un ..."
C,Crema di cacao scura,"Crema di cacao scura, caratteristiche principali
La crema di cacao scura è una crema alcolica aromatizzata dal gusto denso e corposo, ..."
C,Crema di cocco,"Crema di cocco, caratteristiche principali
La crema di cocco è un ingrediente vegetale che trova ampio spazio in cucina come sostituta ..."
C,Crema di funghi,"La crema di funghi è un prodotto perfetto per la stagione fredda, dal sapore unico e delicato, ottimo per dare un tocco in più a ..."
C,Crema di mandorle,La crema di mandorle è una crema spalmabile molto apprezzata sia per il suo sapore che per il suo apporto nutrizionale. Si ottiene ...
C,Crema di marroni,"Da non confondere con le castagne, i marroni sono molto diffusi e amati nel Lazio, nelle Marche e in Veneto, ma anche in Svizzera e in ..."
C,Crema di menta bianca,"Crema di menta bianca, proprietà principali
La crema di menta bianca, o crème de menthe, è un liquore di origine francese che si ..."
C,Crema di menta verde,"La crema di menta verde nasce in Francia, infatti il suo nome originario è “Crème de Menthe”. A renderla famosa è stata Sandra Lee, una ..."
C,Crema di nocciole,"La crema di nocciole piace praticamente a tutti, grandi e piccini indistintamente: è un peccato di gola che unisce. Sono rari i casi in ..."
C,Crema di peperoncini,"Crema di peperoncini, caratteristiche principali
La crema di peperoncini è un prodotto della nostra tradizione culinaria e in ..."
C,Crema di rafano,"La salsa al cren, o crema di rafano, è una crema a base di radice di rafano. Questo tubero viene chiamato anche cren o barbaforte, ..."
C,Crema di salmone,"La crema di salmone è un delizioso preparato a base di salmone, che può essere consumata da sola, servita come zuppa, o utilizzata come ..."
C,Crema di tartufi,"La crema di tartufi è una vera delizia, da spalmare direttamente sul pane per fare una merenda sfiziosa, da abbinare a stuzzichini vari ..."
C,Crema di tartufo e funghi,"La crema di tartufo e funghi è una crema usata come condimento solitamente per piatti di pasta, di prima portata. Di base vengono ..."
C,Crema pasticcera,"Crema pasticcera, caratteristiche principali
Crema pasticcera è il nome di un tipo di crema cotta composta da una base fatta di tuorlo ..."
C,Crema spalmabile al cioccolato,La crema spalmabile al cioccolato è l’ingrediente ideale per una colazione o una merenda golosa. Amata da grandi e piccoli in tutto il ...
C,Cremor tartaro,"Utilissimo in cucina, il cremor tartato è un lievito naturale che dona grande morbidezza e sofficità a impasti sia dolci che salati, ma ..."
C,Cremovo,Con il termine Cremovo facciamo riferimento a un vino liquoroso e aromatizzato che si ottiene dal vino Marsala con l’aggiunta del ...
C,Cren,Con il termine cren si fa riferimento alla pianta Armoracia rusticana caratterizzata da una lunga radice aromatica commestibile. È ...
C,Creoli,"Creoli, caratteristiche principali
I creoli, conosciuti anche come spaghetti alla chitarra, sono una pasta fresca all’uovo tipica ..."
C,Crepe,"Crepe, proprietà principali
A colazione, a metà mattinata, a pranzo, a merenda o a cena: c’è una crepe giusta per ogni momento della ..."
C,Crescenza,"Formaggio morbido tipico del nord Italia, la crescenza si ottiene dal latte vaccino pastorizzato e successiva stagionatura a basse ..."
C,Crescione,"Crescione, proprietà principali
Con il termine crescione si identificano diverse erbe aromatiche appartenenti all’ordine delle ..."
C,Crespelle,"Conosciute anche come crêpe, per le loro origini francesi, le crespelle sono delle cialde morbide al tatto e al palato, utilizzate ..."
C,Creste di gallo,Le creste di gallo sono un formato di pasta dalla forma bizzarra e originale e sono caratterizzate dal sapore gustoso e autentico della ...
C,Creste di pollo,"Creste di pollo, caratteristiche principali
Tra gli ingredienti più utilizzati nella cucina italiana c’è, senza ombra di dubbio, la ..."
C,Crioli,"I crioli sono originari del Molise e simili ai maccheroni alla chitarra. La loro particolarità è che vengono tagliati a mano, sono ..."
C,Croccante alle mandorle,Il croccante alle mandorle non ha bisogno di presentazioni perché si tratta di una delle preparazioni dolci più amate di sempre. È ...
C,Croissant salati,"I croissant salati sono dei cornetti conditi con diversi ingredienti, preparati sul momento, senza bisogno di una lievitazione lunga. ..."
C,Crostacei,"Crostacei, proprietà principali
Aragosta, astici, granseola, granchi, scampi, canocchie, mazzancolle, gamberoni, gamberi, gamberetti e ..."
C,Crostini di farina integrale,"Versatili e deliziosi, i crostini di farina integrale sono dadini croccanti o pezzi di mollica tostati e conditi. Vendono serviti con ..."
C,Crostini di pane,"I crostini di pane sono degli ingredienti versatili e squisiti utilizzati per arricchire tantissime preparazioni saltate, come zuppe e ..."
C,Crostoni di pane,"I crostoni di pane non sono altro che un piatto che rimanda alla tradizione contadina del nostro Paese, perché la morte loro è ..."
C,Crusca,"La crusca è il prodotto di scarto dei cereali, l’involucro fibroso che li contiene e che viene separato dalla farina attraverso il ..."
C,Crème de Cassis,"Crème de Cassis, proprietà principali
La Crème de Cassis, o liquore di Cassis, è una bevanda alcolica tipica della Borgogna, diffusa e ..."
C,Csipetke (gnocchetti),"Gli csipetke sono una varietà di pasta fresca all’uovo originaria dell’Ungheria, con la quale vengono preparate alcune ricette tipiche ..."
C,Culatello,"Culatello, proprietà principali
Considerato il re dei salumi, iI culatello è fatto con la parte alta e posteriore della coscia del ..."
C,Cumino,Il cumino è una spezia molto diffusa nella cucina indiana: oltre a essere uno degli ingredienti principali del curry presenta anche ...
C,Cumino in polvere,Il culmino in polvere è un ingrediente ricavato dall’omonima pianta erbacea annuale che viene portato sulle nostre tavole per ...
C,Cuore di palma,"Cuore di palma, proprietà principali
Il cuore di palma è un tipo di alimento ricavato dal tronco interno di alcuni tipi di palma, come ..."
C,Cuori di lattuga,I cuori di lattuga sono in assoluto gli ingredienti più freschi e salutari da portare in tavola in ogni stagione. Ricavati dai cespi di ...
C,Cuori di mare,"Cuori di mare, caratteristiche principali
I cuori di mare devono il loro nome alla forma molto particolare che presentano di profilo, ..."
C,Curaçao,"Il Curaçao è un liquore nato nell’omonima isola, che si affaccia sulle coste del Venezuela e fa parte delle Antille olandesi, nel Mar ..."
C,Curaçao arancione,Il Curaçao arancione è una tipologia del liquore chiamato Curaçao. Già caratterizzato dalla molteplicità di colori che esistono in ...
C,Curaçao blu,"Curaçao blu, proprietà principali
Il Curaçao blu è una delle varianti del Curaçao, disponibile in commercio anche nella versione ..."
C,Curcuma,"La curcuma è una spezia davvero molto apprezzata in cucina, sia per il suo aroma caldo e pungente, sia per le sue proprietà benefiche. ..."
C,Curry,"Curry, proprietà principali
In Italia con il termine curry si indica una polvere che si ottiene dalla macinazione e tostatura di ..."
D,Dado Bimby,"Il Bimby è ormai divenuto un accessorio indispensabile in cucina, il miglior alleato per preparare centinaia di ricette deliziose e ..."
D,Dado ai funghi,"Il dado viene comunemente utilizzato per cucinare minestre e risotti in maniera rapida e semplicissima, senza dover prima preparare del ..."
D,Dado di carne,"Dado di carne, caratteristiche principali
Il dado di carne è usato come base di piatti semplici ai quali è in grado di dare un sapore ..."
D,Dado di pollo,"Il dado di pollo è un preparato, che può essere fatto in casa o prodotto industrialmente, a base di carne di pollo e di verdure. Il suo ..."
D,Dado vegetale,"Dado vegetale, proprietà e valori nutrizionali
Il dado vegetale è un concentrato a base di sale, grassi – anche di palma -, aromi, ..."
D,Daikon,"Il daikon, chiamato anche ravanello cinese, giapponese o invernale, è una varietà di ravanello che arriva dall’Est dell’Asia. Ha un ..."
D,Dashes Peychaud’s bitters,"Il Dashes Peychaud’s bitters è un bitter a base di genziana e altre erbe aromatiche, dal corpo leggero: una delle sue caratteristiche ..."
D,Datteri,"Datteri, proprietà principali
I datteri sono i frutti di un tipo di palma che fruttifica solo una volta ogni due anni coltivata fin ..."
D,Dentice,"Dentice, proprietà principali
Il dentice è un pesce di mare appartenente alla famiglia degli Sparidi, proprio come il pagello, il ..."
D,Distillato di amarene,
D,Distillato di lamponi,"Il distillato di lamponi è una bevanda diffusa in particolare al Nord, in Trentino Alto Adige e Valle d’Aosta, ma apprezzata anche nel ..."
D,Ditali lisci,"Ditali lisci, caratteristiche principali
I ditali lisci fanno parte della categoria delle paste cortissime e sono realizzati con semola ..."
D,Ditalini rigati,"Un vero e proprio must della cucina italiana, un formato di pasta apprezzatissimo che può essere condito in molti modi diversi: i ..."
D,Ditaloni rigati,"Ditaloni rigati, caratteristiche principali
I ditaloni rigati derivano da un impasto di semola di grano duro e acqua. Sono poi ..."
D,Donzella,"Donzella, caratteristiche principali
La donzella, detta anche girella o pesce carabiniere, fa parte della famiglia dei Labridi. Si ..."
D,Doppio concentrato di pomodoro,"Il doppio concentrato di pomodoro conferisce colore, sapore e struttura a primi e secondi piatti della tradizione italiana che si ..."
D,Dragoncello,"Dragoncello, proprietà principali
Il dragoncello è una pianta aromatica perenne che appartiene alla grande famiglia delle Asteracee, ..."
D,Dry Gin,"Il Dry Gin è la varietà più popolare e bevuta nel mondo: il suo nome indica che la bevanda alcolica è secca, ossia non è dolce. Durante ..."
D,Dry Vermouth,"Dry Vermouth, caratteristiche principali
Il Dry Vermouth, o più semplicemente Dry Vermut, è un vino liquoroso dolce aromatizzato con ..."
E,Edamame,"Edamame, proprietà principali
Gli edamame sono fagioli di soia dalla forma allungata e un colore verde brillante. La semina, su terreni ..."
E,Eglefino,"L’eglefino è un pesce di mare, conosciuto anche con il nome di asinello (o haddock in lingua inglese). Si tratta di un pesce il cui ..."
E,Eglefino affumicato,"Eglefino affumicato, caratteristiche principali
L’eglefino affumicato deriva dal cosiddetto pesce asinello. L’affumicatura è un ..."
E,Eliche,Le eliche sono pasta corta a spirale stretta prodotta con semola di grano duro coltivato e molito in Italia e che si avvale del marchio ...
E,Emmental,"Emmental, proprietà principali
L’Emmental è un formaggio a pasta dura, prodotto con latte vaccino parzialmente scremato, crudo o ..."
E,Entrecòtes,"Entrecôtes, caratteristiche principali
Deve il suo nome alla posizione in cui si trova la parte da cui viene estratta la carne nel ..."
E,Erba cipollina,"Erba cipollina, proprietà principali
L’erba cipollina è una pianta aromatica spontanea appartenente alla famiglia delle ..."
E,Erba medica,"L’erba medica, dal nome botanico Medicago Sativa, è una pianta appartenente alla famiglia delle leguminose. Originaria dell’Asia ..."
E,Erbe aromatiche,"I loro usi sono tantissimi e accompagnano le ricette della nostra tradizione o quelle inedite e fantasiose, stiamo parlando delle erbe ..."
E,Eritritolo,
E,Essenza di senape,"Impiegata per aromatizzare e dare forma ad alcune delle più famose ricette della nostra tradizione, l‘essenza di senape è un ..."
E,Estratto di carne,"Estratto di carne, caratteristiche principali
L’estratto di carne è un ingrediente che in cucina assume un ruolo molto importante. Si ..."
E,Estratto di mandorle,"Poche gocce sono sufficienti ad aromatizzare dolci, dessert ma anche ricette esotiche: si tratta dell’estratto di mandorle, che ..."
E,Estratto di vaniglia,L’estratto di vaniglia è un ingrediente molto utilizzato in cucina e in pasticceria. È indispensabile per aromatizzare un gran numero ...
E,Estratto vegetale,
F,Fagianella,"La selvaggina presenta solitamente un gusto molto particolare, e non è apprezzata da tutti. Non è però il caso della fagianella, le cui ..."
F,Fagiano,Fagiano è il nome che viene attribuito a numerose specie di uccelli che fanno parte della famiglia dei Phasianidae (un ordine dei ...
F,Fagioli azuki,"Fagioli azuki, proprietà principali
Sempre più diffusi anche in Italia, l’azuki veniva definito il “re dei fagioli” per le sue ..."
