Letter,Title,Description
R,Rana pescatrice (coda di rospo),"Rana pescatrice (coda di rospo), proprietà principali
La rana pescatrice – nota anche come coda di rospo proprio perché se ne consuma ..."
R,Rane,"Rane, caratteristiche principali
Gustose e dalle carni delicate, le rane sono un alimento che viene consumato sin dall’antichità per le ..."
R,Rape,"Le rape sono radici dal sapore dolciastro, vengono usate molto in cucina. Si tratta di un ortaggio tipico dell’agricoltura italiana, ..."
R,Ravanelli,"Ravanelli, proprietà principali
I ravanelli sono ortaggi dalla stessa famiglia del sedano rapa, della rapa e del cavolfiore, ma anche ..."
R,Razza,"La razza è un pesce cartilagineo, conosciuto anche con il nome di arzilla o pigara petrosa. Si trova soprattutto nei fondali fangosi o ..."
R,Reale di asino,"La reale di asino è una carne rossa dal gusto deciso, consumata soprattutto nell’Italia Settentrionale dove è alla base di alcuni ..."
R,Red Bull,"Red Bull, caratteristiche principali
La Red Bull è una bevanda energetica analcolica prodotta dall’omonima azienda. È estremamente ..."
R,Reginette,Le reginette sono un formato di pasta lunga che fa parte della tradizione napoletana. La pasta è valorizzata dall’arricciatura alle ...
R,Ribes,Il ribes è una pianta appartenente alla famiglia delle Grossulariaceae. I frutti consistono in piccole bacche dal colore cangiante e ...
R,Ricci di mare,"Ricci di mare, proprietà principali
Il ricci di mare sono organismi marini invertebrati protetti da aculei che possono assumere ..."
R,Ricciola,"Ricciola, proprietà principali
La ricciola è un pesce azzurro molto pregiato. Esteriormente e morfologicamente ricorda la struttura del ..."
R,Riccioli di cioccolato fondente,I riccioli di cioccolato fondente sono largamente usati in pasticceria come elemento decorativo di un gran numero di dolci. Possono ...
R,Ricotta,"Ricotta, proprietà principali
La ricotta è un latticino – non un formaggio – ottenuto dal siero del latte – non dalla cagliata – ..."
R,Ricotta di pecora,"La ricotta di pecora è un prodotto caseario da sapore intenso e “rustico”, soprattutto se paragonata alla tradizionale ricotta vaccina. ..."
R,Ricotta forte,"La ricotta forte è un formaggio morbido spalmabile di lunga tradizione, nato dall’usanza contadina di non buttare via gli avanzi della ..."
R,Ricotta salata,"La ricotta salata è un prodotto caseario dalla lunga tradizione, che affonda le sue radici nell’Italia meridionale (e soprattutto in ..."
R,Ricotta secca affumicata,La ricotta secca affumicata è un prodotto tipico di alcune zone del meridione: viene realizzata soprattutto in Calabria e in Sardegna. ...
R,Rigaglie di pollo,"Rigaglie di pollo, caratteristiche principali
Ricercate e molto speciali, le rigaglie di pollo comprendono tutti gli scarti della ..."
R,Rigatino toscano (pancetta),"Il rigatino toscano è un tipo di pancetta molto apprezzato, un prodotto tipico della regione Toscana – e in particolare della provincia ..."
R,Rigatoni,"Rigatoni, caratteristiche principali
I rigatoni sono un formato di pasta cilindrica di varie lunghezza, diffusa in tutta l’Italia. ..."
R,Riso Arborio,"Riso Arborio, proprietà principali
L’Arborio è un riso superfino dai chicchi perlati molto lunghi, con un nucleo che rimane al dente e ..."
R,Riso Basmati,"È l’assoluto protagonista dei nostri primi piatti, e non solo, e si presta a gustosissime ricette che mettono d’accordo grandi e ..."
R,Riso Carnaroli,"Il riso Carnaroli ha origini italiane ed è considerato fra le varietà più pregiate. Il suo chicco lungo, la consistenza e un alto ..."
R,Riso Roma,"Il riso Roma è una varietà piuttosto apprezzata di riso, coltivata in tantissime regioni italiane, dal Piemonte alla Lombardia, nelle ..."
R,Riso Vialone Nano,"Tante sono le varietà di riso che vengono ampiamente utilizzate nella nostra cucina: una di queste è il riso Vialone Nano, strettamente ..."
R,Riso glutinoso (mochigome),"Il  riso glutinoso è un tipo di riso asiatico a chicco fino bianco opaco allungato.
Viene chiamato glutinoso ma è privo di glutine e ..."
R,Riso integrale,"Il riso fa parte da sempre della tradizione culinaria italiana. Ne esistono di diversi tipi, ognuno con le proprie caratteristiche. Uno ..."
R,Riso nero Venere,"Riso nero Venere, proprietà principali
Il riso Venere, noto anche come riso nero, è una varietà integrale di riso tutta italiana nata ..."
R,Riso parboiled,"Il riso parboiled non è, come si potrebbe pensare, una particolare varietà di riso. Il suo nome deriva dall’inglese partially boiled ..."
R,Riso per sushi,"Il riso per sushi presenta alcune caratteristiche peculiari perché, com’è noto, esistono varie tipologie di riso e quello adatto alla ..."
R,Riso rosso,"Il riso rosso è una coltura tipica della Cina e di altri Paesi orientali, sebbene oggi si sia diffusa in quasi tutto il mondo. Ha avuto ..."
R,Riso soffiato,Il riso soffiato è un alimento che trova ampio uso soprattutto nella preparazione di prodotti per la prima colazione e di dolci. Vanta ...
R,Risoni,"In Italia la pasta è uno dei piatti più consumati (e apprezzati) in assoluto. Sono molte le ricette che arrivano dalla tradizione, e ..."
R,Roastbeef,"Roastbeef, proprietà principali
Il roastbeef, scritto anche roast beef ma in italiano è altrettanto corretta la dicitura di rosbif, è ..."
R,Robinia,"Forse non tutti hanno sentito parlare della robinia, un albero di grandi dimensioni che cresce in tutta Europa e i cui fiori sono ..."
R,Robiola,"La robiola è un formaggio fresco a pasta molle, senza crosta. Si tratta di un prodotto tipico del Nord Italia che prende il nome da ..."
R,Robioletta fresca,Con il termine robioletta fresca facciamo riferimento a uno dei più importanti e apprezzati formaggi italiani che caratterizzano in ...
R,Rombo,"Rombo, proprietà principali
Il rombo è un pesce piatto di forma romboidale, con pelle rugosa, un lato bruno-rossastro e l’altro bianco, ..."
R,Rosa canina,"La rosa canina è un arbusto selvatico spontaneo molto diffuso in Italia, facente parte della famiglia delle Rosaceae. Le sue bacche, ..."
R,Rosmarino,"Il rosmarino, il cui nome scientifico è Salvia rosmarinus, è una pianta aromatica perenne appartenente alla famiglia delle Lamiaceae. ..."
R,Rucola,"Rucola, proprietà principali
La rucola, o ruchetta, è una pianta erbacea annuale della stessa famiglia di cavolfiore, broccoli, cavoli ..."
R,Rum,"Bianco, dorato, scuro o speziato, il rum è una bevanda dalle diverse tipologie e con lavorazioni che differiscono tra cubano, ..."
R,Ruote,"Le ruote sono un formato di pasta dal design particolare: sembrano, come dice il nome stesso, la ruota di un carro. Hanno una forma ..."
R,Rye Whisky,Il Rye Whisky è un whisky davvero eccezionale di origini americane apprezzato e consumato in tutto il mondo. Si tratta di un ...
S,Saba,La saba o sapa è un prodotto tipico della tradizione gastronomica di diverse regioni italiane. Si tratta di uno sciroppo d’uva con un ...
S,Sagne,La ricca tradizione pastaia del centro e sud Italia ha dato origine a moltissimi formati di pasta che vengono ancora oggi utilizzati ...
S,Sagne incannulate,Le sagne incannulate sono un primo piatto tipico salentino. Vengono chiamate anche sagne ricce per la loro forma arricciata: è un tipo ...
S,Saké,"Il sake è una delle bevande più popolari in Giappone, ma ormai si sta diffondendo a macchia d’olio grazie alla popolarità della cucina ..."
S,Salame,"Salame, proprietà principali
Il salame è un insaccato crudo e stagionato. L’Italia rappresenta la patria d’elezione per molte tipologie ..."
S,Salame tipo Napoli,"Salame tipo Napoli, proprietà principali
Il salame tipo Napoli è un insaccato crudo tipico della regione Campania composto da carne ..."
S,Salamella,"Salamella, caratteristiche principali
Dolce e speziata, la salamella è una salsiccia di carne di maiale che si trova principalmente nel ..."
S,Salamini piccanti,"Salamini piccanti, proprietà principali
I salamini piccanti fanno parte delle carni insaccate e conservate e dei salumi crudi. Si ..."
S,Salamini verzini,I salamini verzini sono un insaccato fresco tipico della tradizione lombarda. Si tratta di piccole salsicce preparate con carne di ...
S,Salamoia Sichuan,"La salamoia Sichuan è un alimento molto particolare: si tratta di verdure conservate sottaceto, provenienti dalla tradizione orientale ..."
S,Salatini stick,"I salatini stick sono l’ingrediente perfetto per l’aperitivo: croccanti e saporiti sono il finger food per eccellenza, e vengono ..."
S,Sale,"Con il termine sale in genere si intende il cloruro di sodio, l’esaltatore di sapidità più usato in cucina nonché ingrediente ..."
S,Sale grosso,Il sale grosso è un elemento prezioso e un minerale essenziale per l’organismo umano. Si tratta di un ingrediente presente in tutte le ...
S,Salmerino,"Il salmerino è un pesce che fa parte della famiglia dei salmonidi, proprio come la trota e il salmone. Si tratta di una specie ..."
S,Salmone,"Salmone, proprietà principali
Il salmone è un pesce che nasce nelle acque dolci e che si trasferisce in acque salate per poi tornare ..."
S,Salmone affumicato,Il salmone affumicato è un prodotto diffusissimo sulle tavole degli italiani. Si trova in tutti i supermercati ed il suo consumo non ...
S,Salsa Worcestershire,"Salsa Worcestershire, proprietà principali
La salsa Worcestershire (detta anche salsa Worcester) è d’origine inglese e deve il suo nome ..."
S,Salsa aioli,"Salsa aioli, proprietà principali
La salsa aioli è un composto cremoso e corposo, utilizzato principalmente come guarnizione o ..."
S,Salsa allo yogurt,"La salsa allo yogurt è una preparazione utilizzata per condire pesce, carne o verdure. Leggera, gustosa e facile da preparare in pochi ..."
S,Salsa americana,"Salsa americana, proprietà principali
La salsa americana è una ricetta classica della cucina francese a base di cipolle tritate, ..."
S,Salsa barbecue,"Gustosa, speziata e con una consistenza inconfondibile, la salsa barbecue è una salsa tipica americana che si accompagna con tantissimi ..."
S,Salsa bernese,"La salsa bernese, conosciuta anche con il nome di “bernese”, è una salsa di condimento per piatti di ogni genere che si abbina alla ..."
S,Salsa blue cheese,"La salsa blue cheese nasce in America ed è fatta a base di formaggio, una varietà blu – per l’appunto – che ricorda il gorgonzola ..."
S,Salsa chili dolce,"Salsa chili dolce, proprietà principali
La salsa chili dolce, conosciuta anche come Thai sweet chili sauce, è un condimento leggermente ..."
S,Salsa chili piccante,"La salsa chili piccante rappresenta una vera e propria istituzione nella cucina messicana, e ormai è diffusa in tutto il mondo. Dal ..."
S,Salsa di fagioli,"La salsa di fagioli è un delizioso accompagnamento per molte ricette a base di carne, ma è anche un alimento consumato spesso nella ..."
S,Salsa di noci,"Salsa di noci, proprietà principali
La salsa di noci, in dialetto ligure sarsa de noxe o tocco de noxe che diventa ajà sull’Appennino ..."
S,Salsa di ostriche,"Salsa di ostriche, caratteristiche principali
La salsa di ostriche deriva dalla cottura dei molluschi ed è utilizzata per insaporire le ..."
S,Salsa di pesce,"Salsa di pesce, caratteristiche principali
La salsa di pesce è un condimento che si ottiene dalla lunga macerazione del pesce ed è ..."
S,Salsa di soia,"La salsa di soia è una salsa originaria della Cina, fermentata molto sapida. Nel corso del tempo si è diffusa in tutto il mondo, ma è ..."
S,Salsa guacamole,"La salsa guacamole è fatta a base di avocado, il noto frutto della Persea americana, un albero da frutto della famiglia delle Lauracee. ..."
S,Salsa harissa,"La salsa harissa è una salsa piccantissima a base di peperoncino rosso, tipica del Nord Africa, in particolar modo della Tunisia: a ..."
S,Salsa hoisin,"La salsa hoisin, chiamata anche hoi-sin o salsa nera per via del suo colore scuro, è una salsa che viene utilizzata nella cucina ..."
S,Salsa ketchup,"La salsa ketchup è una salsa agrodolce realizzata con pomodoro utilizzata sopratutto per accompagnare fritti di ogni genere, per ..."
S,Salsa messicana,"È la regina delle salse, assoluta protagonista di menu destinati agli amanti dei sapori piccanti e a tutte le persone che vogliono ..."
S,Salsa mojo,"Salsa mojo, caratteristiche principali
La salsa mojo, o mojo picón, è una salsa tradizionale che arriva dalle Canarie e realizzata con ..."
S,Salsa okonomiyaki,"Un prodotto molto amato della cucina giapponese e ormai diffuso anche in Italia è l’okonomiyaki, una specie di pancake dal sapore ..."
S,Salsa olandese,"Salsa olandese, caratteristiche principali
La salsa olandese, in francese chiamata sauce hollandaise, è un’emulsione di tuorlo d’uovo e ..."
S,Salsa per arrosto,"C’è sempre un buon motivo per portare in tavola un secondo piatto ricco di gusto e sapori come l’arrosto, a patto che questo sia ..."
S,Salsa peverada,"La cucina veneta e quella trentina sono ricche di salse che accompagnano i tradizionali bolliti di carne, e non solo. La salsa peverada ..."
S,Salsa remoulade,"La salsa remoulade fa parte del vasto universo delle salse francesi. Si tratta di un alimento a base di maionese, arricchito con ..."
S,Salsa rubra,"Salsa rubra, proprietà principali
La salsa rubra (conosciuta anche come salsa rossa o bagnet ross) è una salsa di accompagnamento ..."
S,Salsa satay,"La salsa satay è una salsa di origine asiatica a base principalmente di arachidi tostate. Apprezzata per il suo equilibrio tra dolce, ..."
S,Salsa tarator,La salsa tarator è un ingrediente molto apprezzato in cucina per il suo sapore intenso e particolare che si sposa perfettamente con ...
S,Salsa tartara,La salsa tartara è una preparazione di origine francese molto apprezzata per insaporire secondi piatti a base di carne e di pesce. Può ...
S,Salsa teriyaki,La salsa teriyaki è una salsa giapponese famosa in tutto il mondo per il gusto particolare e inedito che la contraddistingue. ...
S,Salsa thai,"Leggermente piccante, aromatica, con un’impronta che resta sul palato: la salsa thai è un condimento onnipresente sulle tavole ..."
S,Salsa tzatziki,"La salsa tzatziki è una salsa preparata con cetrioli, aglio e yogurt. Inventata in Grecia, questa ricetta è fresca, semplice e gustosa. ..."
S,Salsiccia,"Salsiccia, proprietà principali
La salsiccia è un insaccato prodotto con un misto di carne magra e grassa di maiale, tritata o battuta ..."
S,Salsiccia pezzente,"Salsiccia pezzente, proprietà principali
Per la carne che la costituisce, la salsiccia pezzente – nota anche come pezzenta – è forse il ..."
S,Salumi misti,I salumi misti rappresentano da soli rappresentano un piatto ricco di gusti e sapori nostrani da portare in tavola per aperitivi o ...
S,Salvia,La salvia (Salvia officinalis) è una pianta aromatica della famiglia delle Laminaceae. Conosciuta fin dall’antichità per le sue ...
S,Sambuca,"La sambuca è un liquore dal sapore dolce e inconfondibile dalle origini italiane. Si tratta di una preparazione realizzata con acqua, ..."
S,Santoreggia,"Santoreggia, proprietà principali
Le proprietà aromatiche e officinali della santoreggia sono note fin dall’antichità. Questa pianta, ..."
S,Sarde,"Sarde, caratteristiche principali
Le sarde sono una varietà di di pesce osseo marino della famiglia dei Clupeidae. Si associano spesso ..."
S,Sardine,"Sardine, proprietà principali
Spesso confuse con le acciughe, le sardine sono pesci azzurri dal corpo allungato e schiacciato sui lati, ..."
S,Sauri,"Sauri, caratteristiche principali
I sauri, o sugarelli, sono pesci ossei di mare che appartengono alla famiglia dei Carangidae. Si ..."
S,Savoiardi,"I savoiardi sono biscotti dolci dalla consistenza molto spugnosa e friabile, devono il loro nome alla Savoia, regione storica della ..."
S,Scalogno,"Scalogno, proprietà principali
Lo scalogno è una pianta erbacea della famiglia delle Lilliaceae – la stessa di porro ed erba cipollina ..."
S,Scamone di manzo,Lo scamone di manzo è un taglio di carne bovina considerato di prima scelta. Si tratta di un pezzo muscolare che si trova nell’area ...
S,Scamone di vitello,"Lo scamone di vitello è un taglio di carne ricavato dal bovino maschio di età inferiore ai 12 mesi, di peso inferiore ai 250 kg, ..."
S,Scamorza,"Scamorza, proprietà principali
La scamorza è un formaggio a pasta semi cruda in parte filata realizzata utilizzando latte di mucca (di ..."
S,Scampi,"Scampi, proprietà principali
Gli scampi sono crostacei decapodi, proprio come astici, aragoste, granchi, gamberi, mazzancolle e ..."
S,Scamponi,
S,Schweppes al limone,"Con il suo sapore leggermente aspro, ma pieno e intenso, la Schweppes al limone è in assoluto la bibita preferita di tutti gli ..."
S,Scialatielli,Gli scialatielli sono una tipologia di pasta fresca utilizzata nella cucina tradizionale campana. Il nome deriva dall’unione di due ...
S,Sciroppo alla menta,"Sciroppo alla menta, proprietà principali
Lo sciroppo alla menta è ingrediente che viene estratto dalle foglie di menta e si ottiene da ..."
S,Sciroppo d'acero,"Lo sciroppo d’acero non è altro che un alimento molto dolce che si ricava dalla linfa (lo xilema, a voler essere precisi) di alberi ..."
S,Sciroppo di agave,"Sciroppo di agave, proprietà principali
Lo sciroppo di agave è un ingrediente estremamente dolce, che viene prodotto a partire dalla ..."
S,Sciroppo di amarena,"Sciroppo di amarena, caratteristiche principali
Goloso ma non di certo dietetico. Per il palato è una vera delizia ma attenzione alle ..."
S,Sciroppo di fiori di sambuco,"Bevanda delicata con note intense e dolci, lo sciroppo di fiori di sambuco è una delizia impiegata nella preparazione di molti drink, ..."
S,Sciroppo di fragola,"Sciroppo di fragola, caratteristiche principali
È dissetante, fresco e colorato. Lo sciroppo di fragola può rivelarsi un ottimo alleato ..."
S,Sciroppo di glucosio,"Sciroppo di glucosio, proprietà principali
Lo sciroppo di glucosio è una sostanza densa e viscosa trasparente, con riflessi leggermente ..."
S,Sciroppo di granatina,"Lo sciroppo di granatina, chiamato semplicemente anche granatina, è una miscela analcolica impiegata in cucina per la preparazione di ..."
S,Sciroppo di lampone,"Sciroppo di lampone, caratteristiche principali
Bevanda, ingrediente e potente antinfiammatorio: lo sciroppo di lampone è apprezzato ..."
S,Sciroppo di lime,"Lo sciroppo di lime può essere acquistato già pronto o preparato in casa con pochi semplici ingredienti, tra cui spiccano i lime e lo ..."
S,Sciroppo di mais,Lo sciroppo di mais si ottiene dall’amido di mais ed è noto per le sue proprietà dolcificanti. È stato introdotto nell’industria ...
S,Sciroppo di malto d'orzo,"Lo sciroppo di malto d’orzo è un dolcificante naturale, ottimo succedaneo del comune zucchero bianco. Lo si produce a partire dai ..."
S,Sciroppo di malto di riso,"Lo sciroppo di malto di riso è un dolcificante naturale, dal colore ambrato, ottimo sostituto del comune zucchero bianco. Il malto, in ..."
S,Sciroppo di menta,Lo sciroppo di menta è perfetto per l’estate e per preparazioni che vogliono dare freschezza a ricette e bevande. Il procedimento per ...
S,Sciroppo di orzata,"Sciroppo di orzata, caratteristiche principali
Lo sciroppo di orzata è una bevanda analcolica vegetale che si presenta sotto diverse ..."
S,Sciroppo di sambuco,"Perfetto per aperitivi e cocktail, lo sciroppo di sambuco è una bibita fresca e dissetante che può essere realizzata in casa o ..."
S,Sciroppo di tamarindo,"Lo sciroppo di tamarindo è una bevanda gustosa e dissetante, ma anche un vero alleato per l’organismo. Il suo ingrediente principale, ..."
S,Sciroppo di vaniglia,
S,Sciroppo di zenzero,"Sciroppo di zenzero, proprietà principali
Lo sciroppo di zenzero è composto da semplici ingredienti: acqua, zucchero e zenzero (oltre ..."
S,Sciroppo di zucchero,"Lo sciroppo di zucchero, anche conosciuto come zucchero liquido, è un ingrediente versatile in cucina che può essere utilizzato in vari ..."
S,Sciroppo di zucchero di canna,"Lo sciroppo di zucchero di canna, denominato anche zucchero liquido, è una miscela di acqua e glucosio utilizzata in cucina per ..."
S,Scorfano,"Scorfano, proprietà principali
Lo scorfano rosso è un pesce facile da riconoscere: presenta visibili appendici carnose sul mento, lungo ..."
S,Scorza d'arancia,"Scorza d’arancia, caratteristiche principali
La scorza d’arancia è un alimento spesso sottovalutato ma che trova ampio utilizzo in ..."
S,Scorza di cedro,"Della frutta non si getta niente, neanche la buccia: questa può essere impiegata in vari modi, per sfruttare appieno le sue proprietà ..."
S,Scorza di clementine,"Dei frutti della terra non si butta via niente, neanche la buccia. Proprio questa, infatti, può trasformarsi in un ingrediente ..."
S,Scorza di lime,"Il lime è un frutto tropicale che ricorda molto il limone, sebbene abbia un aspetto più piccolo e un sapore più intenso. Di questo ..."
S,Scorza di limone,"Scorza di limone, proprietà principali
La scorza di limone è la parte esterna dell’omonimo agrume che viene ottenuta intagliando la sua ..."
S,Scorza di pompelmo,"Quando si tratta di arricchire una pietanza e donarle un sapore particolare, spesso vengono utilizzati ingredienti piuttosto bizzarri, ..."
S,Scorzobianca,Il suo nome è scorzobianca ed è una radice commestibile caratterizzata da un sapore dolciastro che mette d’accordo tutti. Considerata a ...
S,Scorzonera,"Scorzonera, proprietà principali
La scorzonera, conosciuta anche come asparago d’inverno, è un ortaggio poco diffuso appartenente alla ..."
S,Scotch Whisky,"Lo scotch whisky altro non è che un distillato che si ottiene dalla lavorazione dei cereali. La sua storia è molto antica, ma questo ..."
S,Sedani rigati,I sedani rigati sono un formato di pasta corta dalle straordinarie caratteristiche. La storia vuole che questa variante pià comune del ...
S,Sedanini lisci,"Molte sono le varianti di pasta diffuse in tutto il Paese, e ciascuna di esse ha una storia ben precisa e una lunga tradizione alle ..."
S,Sedanini rigati,"I sedanini sono una tipologia di pasta molto amata e diffusa in tutta Italia, perfetta per raccogliere il sugo e creare primi piatti ..."
S,Sedano,"Sedano, proprietà principali
Il sedano è una pianta ebacea dall’intenso odore aromatico caratterizzata da costole fogliari o radici ..."
S,Sedano rapa,"Sedano rapa, proprietà principali
Bruno e rugoso all’esterno, bianco all’interno, con foglie verdi scuro e forma tondeggiante: il ..."
S,Segale,"Segale, proprietà principali
Della famiglia di piante erbacee alle quali appartengono il farro, il grano e l’orzo, la segale è una ..."
S,Seitan,"Seitan, caratteristiche principali
Proteico e ricco di gusto, il seitan è un alimento che si ricava dal glutine del grano tenero e da ..."
S,Seltz,"Il seltz, conosciuto anche come acqua di seltz, altro non è che un’acqua molto gassata. In pratica è un’acqua con un elevato contenuto ..."
S,Semi di carvi,"I semi di carvi, o “cumino dei prati”, provengono dalla pianta erbacea Carum Carvi: sia la pianta che i semi sono molto simili al ..."
S,Semi di chia,"I semi di chia sono i frutti commestibili di una pianta, la Salvia hispanica, originaria del Messico e degli Stati Uniti ..."
S,Semi di cipolla,
S,Semi di finocchio,"Semi di finocchio, caratteristiche principali
I semi di finocchio derivano dalla pianta di finocchio che, come il prezzemolo, ..."
S,Semi di girasole,"I semi di girasole sono il frutto della specie Helianthus annuus. In commercio ce ne sono sia neri che striati. In entrambi i casi, i ..."
S,Semi di lino,"Semi di lino, caratteristiche principali
I semi di lino rappresentano un piccolo concentrato di benessere per il nostro organismo. Sono ..."
S,Semi di papavero,I semi di papavero sono dei semi oleosi ottenuti dal papavero da oppio e vengono raccolti direttamente dal baccello del fiore ...
S,Semi di senape,"I semi di senape sono dei piccoli, preziosi chicchi che sprigionano la loro piccantezza non appena entrano a contatto con l’acqua. ..."
S,Semi di zucca,"I semi di zucca appartengono alla famiglia delle Curcubitaceae, categoria di vegetali che annovera anche la zucchina, il cetriolo, il ..."
S,Semola di grano duro rimacinata,La farina di semola di grano duro rimacinata viene prodotta grazie alla macinazione di una miscela di grani duri. Si tratta di un ...
S,Semolino,"Il semolino è una farina ottenuta dalla macinazione dei chicchi dei cereali, soprattutto grano duro. Dal gusto delicato, viene ..."
S,Senape,"Senape, proprietà principali
La senape è una pianta erbacea, originaria dell’Asia, dal fusto eretto e foglie di forme ovali impiegate ..."
S,Senape di Digione,"La senape di Digione, conosciuta anche come mostarda, è una salsa famosa e molto antica, preparata con il mosto d’uva. Fa parte della ..."
S,Senape in polvere,"La senape in polvere è una spezia molto usata in cucina, e viene impiegata per preparare la mostarda. È chiamata anche farina di ..."
S,Seppie,"Seppie, proprietà principali
Le seppie sono molluschi di mare appartenenti alla stessa famiglia di moscardini, calamari, totani ..."
S,Seppioline,Le seppioline sono piccoli molluschi di mare che si differenziano dagli altri per il numero dei tentacoli. Questa particolare specie ne ...
S,Sesamo,"Sesamo, proprietà principali
Il sesamo è una pianta erbacea annuale originaria delle Indie Orientali, con foglie poliformi, fiori ..."
S,Sfoglia all'uovo,"Con sfoglia all’uovo si indica una pasta fresca che si prepara in cucina secondo diverse ricette tradizionali, è infatti uno dei ..."
