Letter,Title,Description
L,Latte in polvere,"Il latte in polvere è un derivato del latte vaccino, che viene sottoposto ad un particolare procedimento di essiccazione per eliminare ..."
L,Latte intero,"Latte intero, proprietà principali
In genere con il termine latte intero si intende la bevanda che deriva dalla mungitura dalle femmine ..."
L,Latte parzialmente scremato,"Latte parzialmente scremato, proprietà principali
Il latte parzialmente scremato si ottiene attraverso la diminuzione dei grassi ..."
L,Latte scremato,"Il latte scremato è un latte a cui è stata tolta la componente lipidica. Contiene infatti una quantità di grassi inferiore allo 0,3%, ..."
L,Latterini,"Latterini, proprietà principali
I latterini sono un pesce molto piccolo sia d’acqua dolce che di mare che appartiene alla ..."
L,Latticello,"Latticello, proprietà principali
Il latticello, conosciuto anche come latte acido, è un alimento che deriva dalla lavorazione ..."
L,Lattuga,"Lattuga, proprietà principali
La lattuga è una pianta erbacea molto comune appartenente alla famiglia delle Asteraceae, coltivata ..."
L,Lattuga Lollo,"La lattuga Lollo è una varietà di lattuga molto apprezzata in cucina, non solo per il suo aspetto scenografico ma anche e soprattutto ..."
L,Lattuga a cappuccio,"La lattuga a cappuccio, chiamata anche cappuccina o Trocadero, è un ortaggio molto comune, utilizzato in cucina per numerose ..."
L,Lattuga iceberg,"La lattuga iceberg è una varietà di lattuga denominata a cappuccio, il suo nome scientifico è Lactuca sativa ed è stata introdotta nel ..."
L,Lattuga romana,"Lattuga romana, caratteristiche principali
La lattuga romana fa parte della famiglia delle Compositae e appartiene alla varietà ..."
L,Lattuga romana rossa,La lattuga romana rossa appartiene alla famiglia delle Asteracee e viene coltivata in particolare per il consumo in insalata. Le sue ...
L,Lattughino,"Lattughino, proprietà principali
Il lattughino si presenta in natura in più varietà, che differiscono per il colore. Le sue tonalità ..."
L,Lattughino rosso,"Lattughino rosso, caratteristiche principali
Il lattughino rosso è una verdura ricca d’acqua e di sali minerali, impiegata in fresche ..."
L,Lavanda,"Un profumo intenso che ci porta in mezzo a campi violacei, un sapore delicato e confortante: la lavanda è una pianta che ha ..."
L,Lavarelli,"Lavarelli, caratteristiche principali
I lavarelli sono anche conosciuti con il nome di coregone (Coregonus lavaretus). Si tratta di ..."
L,Legumi,"Con il termine generico legumi si intendono i semi commestibili della famiglia delle leguminose, piante molto diffuse in tutto il mondo ..."
L,Lemonsoda,"Lemonsoda, caratteristiche principali
Lemonsoda si caratterizza per il suo gusto fresco e delicato, perfetto per i periodi più caldi ma ..."
L,Lenticchie,"Lenticchie, proprietà principali
Le lenticchie sono legumi che crescono su una pianta annuale alta dai 20 ai 70 cm, con dritti steli ..."
L,Lenticchie di Castelluccio di Norcia,"Lenticchie di Castelluccio di Norcia, proprietà principali
Le lenticchie di Castelluccio di Norcia sono una IGP che interessa i comuni ..."
L,Lenticchie rosse,"Lenticchie rosse, proprietà principali
Le lenticchie rosse sono una delle tante varietà di lenticchie presenti in commercio. Chiamate ..."
L,Lepre,La lepre è un mammifero lagomorfo che appartiene alla famiglia dei Leporidi e che trova un impiego molto vasto nella nostra cucina per ...
L,Levistico,Il levistico è una pianta officinale utilizzata anche in cucina e apprezzata soprattutto per le molteplici proprietà che per natura gli ...
L,Lievito alimentare,"Il lievito alimentare, detto anche lievito nutrizionale, è un prodotto conosciuto già dall’antichità e ampiamente utilizzato per le sue ..."
L,Lievito di birra fresco,Il lievito di birra fresco è uno degli ingredienti più utilizzati in cucina perché impiegato in tantissime preparazioni a partire da ...
L,Lievito di birra secco in granuli,Il lievito di birra secco in granuli è una delle diverse varianti di lievito presenti in commercio. Si tratta di un fungo microscopico ...
L,Lievito di birra secco in polvere,"Il lievito di birra secco in polvere è un ottimo alleato in cucina, ideale per tantissime preparazioni dolci e salate. Lo si ottiene a ..."
L,Lievito istantaneo,Il lievito istantaneo è un composto formato da carbonato acido di sodio e difosfato disodico che garantisce un utilizzo veloce per la ...
L,Lievito istantaneo per dolci,"Lievito istantaneo per dolci, caratteristiche principali
Il lievito istantaneo per dolci è utilizzato in pasticceria per la ..."
L,Lievito istantaneo per preparazioni salate,"Il lievito istantaneo, formato da carbonato acido di sodio e disosfato disodico, agisce durante la cottura delle preparazioni salate. ..."
L,Lievito madre,"Il lievito madre, o pasta madre, è un impasto a base di acqua e farina che fermenta naturalmente grazie ai lieviti e ai batteri ..."
L,Limanda,La limanda è un pesce di mare che appartiene alla famiglia Pleuronettidi. Questa specie si trova generalmente nei mari poco profondi: ...
L,Lime,"Lime, proprietà principali
Il lime, noto anche come lima o limetta, è un albero con tronco spinoso che fruttifica 3 volte all’anno; ..."
L,Lime kaffir,"Lime kaffir, proprietà principali
Il lime kaffir (o kaffir lime), conosciuto anche con il nome combava, è un agrume di grandezza ..."
L,Limoncello,"Limoncello, proprietà principali
Il limoncello è un tipico liquore campano, diffuso in quasi tutto il mondo, dal gusto dolce e con un ..."
L,Limoni,"Limone, proprietà principali
Il limone è un agrume derivato dall’incrocio di cedro e l’arancio amaro. Si tratta di un albero alto dai 3 ..."
L,Lingua di vitello,"La lingua di vitello fa parte dei taglio del quinto quarto del bovino, come la trippa, il fegato o il cuore e viene perciò classificata ..."
L,Lingue di gatto,Lingue di gatto è il nome attribuito ai biscotti tradizionali che si usano spesso per accompagnare gelati o frutta. Hanno una forma ...
L,Linguine,"Le linguine sono un particolare formato di pasta simile agli spaghetti, ma differente in alcuni aspetti. Le prime tracce di questo ..."
L,Linguine al nero di seppia,"La pasta fresca ha mille varianti, una delle più peculiari delle quali è rappresentata dalle linguine al nero di seppia. La loro ..."
L,Liquirizia,"Liquirizia, proprietà principali
La liquirizia è una pianta erbacea perenne capace di resistere al freddo e al gelo, originaria ..."
L,Liquore Anisetta,"Il liquore Anisetta è un digestivo che nasce nelle Marche e si beve liscio, con ghiaccio o con la mosca – ovvero con qualche chicco di ..."
L,Liquore Armagnac,"Liquore Armagnac, caratteristiche principali
L’Armagnac è un distillato di vino francese, prodotto tradizionalmente nell’area storica ..."
L,Liquore Aurum,"Liquore Aurum, proprietà principali
Il liquore Aurum è un liquore di origine italiana, precisamente abruzzese, che accosta le arance ad ..."
L,Liquore Borsci San Marzano,Il liquore Borsci San Marzano fa parte da decenni della tradizione italiana. La sua storia è molto lunga ed inizia nel 1840 quando il ...
L,Liquore Calvados,"Il liquore Calvados è un’acquavite realizzata con sidro di mela, prodotto in Normandia e diffuso in tutto il mondo. Una delle sue ..."
L,Liquore Centerbe,"Liquore Centerbe, proprietà principali
Il liquore Centerbe è una bevanda spiritosa dal sapore dolce con origini abruzzesi dall’alta ..."
L,Liquore Chartreuse,"Liquore chartreuse, caratteristiche principali
Lo chartreuse, detto anche certosino, è un liquore prodotto – originariamente – dai ..."
L,Liquore Drambuie,"Il Drambuie è un liquore vellutato e iconico, è a base di whisky, che viene aromatizzato con miele di erica, spezie ed erbe. Viene ..."
L,Liquore Galliano,"Liquore Galliano, caratteristiche principali
Il liquore Galliano è una bevanda alcolica di origine italiana estremamente amata dagli ..."
L,Liquore Genepì,Il liquore Genepì è una bevanda alcolica caratteristica delle regioni Piemonte e Valle d’Aosta che si ottiene dalla macerazione delle ...
L,Liquore Kahlua,"Liquore Kahlua, caratteristiche principali
Il Kahlua è il liquore al caffè più famoso del mondo. La sua ricetta è molto semplice. Si ..."
L,Liquore Kummel,"Liquore Kummel, proprietà principali
Il liquore Kummel è una grappa di cumino. Noto anche con i termini tedeschi kümmel o kimmel, si ..."
L,Liquore Mandarinetto,
L,Liquore Mistrà,Il liquore Mistrà è una bevanda alcolica tutta italiana ottenuta dai distillati naturali delle piante aromatiche come anice verde e ...
L,Liquore Ratafià,"Il liquore ratafià è diffuso in alcune zone d’Italia, in Svizzera, in Spagna e in Francia. Ha una tradizione antica, per esempio in ..."
L,Liquore Rosolio bianco,"Il liquore Rosolio è chiamato anche liquore del passato, è nato in Italia nei monasteri medievali ed è disponibile in numerose ..."
L,Liquore Southern Comfort,"Il Southern Comfort è un liquore, derivante dal whisky: differentemente da altri tipi di liquore, per il Southern Comfort possiamo ..."
L,Liquore Special Danesi,
L,Liquore Strega,"Liquore Strega, proprietà principali
Il liquore Strega ha una storia molto affascinante che affonda le radici intorno alla metà ..."
L,Liquore Triple Sec,Il liquore Triple Sec è una bevanda alcolica molto utilizzata sia come base per la preparazione di tantissimi cocktail che in ...
L,Liquore al caffè,"Liquore al caffè, caratteristiche principali
Il caffè e l’alcol sono gli ingredienti principali di questo preparato, ai quali poi andrà ..."
L,Liquore al cedro,Il liquore al cedro è una bevanda alcolica dal sapore delizioso e dolce che mette d’accordo tutti. Si tratta dell’alternativa per ...
L,Liquore al cioccolato,"Il liquore al cioccolato è una bevanda alcolica dal sapore squisitamente dolce, dovuto alla presenza del cacao come suo principale ..."
L,Liquore al mandarino,"Liquore al mandarino, caratteristiche principali
Il liquore al mandarino si ottiene attraverso la macerazione delle bucce nell’alcool, ..."
L,Liquore all'amaretto,"Divenuto famoso grazie a una celebre casa del Nord Italia, il liquore all’amaretto viene preparato con mandorle e zucchero. Si tratta ..."
L,Liquore all'ananas,Il liquore all’ananas è una bevanda alcolica preparata con il frutto dell’ananas. L’ananas sativus è un albero originario dell’America ...
L,Liquore all'anice,"Portare in tavola un liquore all’anice, alla fine di ogni pasto, vuol dire regalare ai commensali un’esperienza di gusto molto ..."
L,Liquore all'arancia,"Liquore all’arancia, proprietà principali
Il liquore all’arancia detto anche arancello è una preparazione alcolica a base di alcool ..."
L,Liquore alla banana,"Liquore alla banana, caratteristiche principali
Il liquore alla banana, detto anche bananino, si prepara per infusione in alcool della ..."
L,Liquore alla frutta,"Il liquore alla frutta è una bevanda ottenuta dalla miscelazione dell’alcol alimentare con frutta. Viene ottenuto per infusione, a ..."
L,Liquore alla menta,"Rinfrescante e digestivo, il liquore alla menta è un ottimo fine pasto da offrire agli amici dopo una buona cena, soprattutto se a ..."
L,Liquore alla pesca,"Il liquore alla pesca, conosciuto anche come pescolino o pesconcello, e con tanti altri soprannomi locali, è una bevanda spiritosa a ..."
L,Liquore alla vaniglia,"Il liquore alla vaniglia è una bevanda spiritosa caratterizzata da un sapore dolce e un’aroma inconfondibile dato, appunto, dal suo ..."
L,Liquore alle more,Nulla è più gratificante di un sorso di liquore alle more per concludere alla perfezione un pasto. Protagoniste assolute di questa ...
L,Lombata di maiale,
L,Lombata di manzo,"La conosciamo con il nome di lombo, lombata di manzo o lombatina nel caso in cui sia stata ricavata da un vitello. Questo taglio di ..."
L,Lombata di vitello,"Con il termine lombata di vitello facciamo riferimento a uno dei tagli più utilizzati e apprezzati in cucina paragonabile, per ..."
L,Lombo di maiale,"Lombo di maiale, caratteristiche principali
Il lombo di maiale rappresenta il taglio di carne suina più noto e più consumato per le sue ..."
L,Lonza di maiale,La lonza di maiale è un taglio ricavato dal suino e fa riferimento al muscolo del carré senza gli ossi. È un taglio molto gustoso e ...
L,Lonzino di maiale,"Lonzino di maiale, caratteristiche principali
Il lonzino di maiale rappresenta un prodotto del taglio del lombo, una parte del maiale ..."
L,Luccio,"Luccio, proprietà principali
Il luccio è un pesce di acqua dolce con una bocca grande e allungata su cui crescono numerosi denti ..."
L,Lumache,"Lumache, proprietà principali
Le lumache da gastronomia si allevano all’aperto in recinti con rete antibava, antifuga ed anti raggi ..."
L,Lumache di mare,"Le lumache di mare, conosciute anche con il nome di maruzzelle, sono un ingrediente utilizzato in numerose ricette tradizionali ..."
L,Lumaconi rigati,"Lumaconi rigati, proprietà principali
I lumaconi rigati sono un formato di pasta piuttosto particolare: si tratta di grandi gusci di ..."
L,Luppolo,Il luppolo (Humulus lupulus) è un pianta che appartiene alla famiglia delle Cannabaceae. Si tratta di un ingrediente perfetto per ...
M,Maccarones,Con il termine maccarones facciamo riferimento a una pasta tradizionale e caratteristica di una terra meravigliosa: la Sardegna. È ...
M,Maccheroncini,"I maccheroncini sono un formato di pasta medio-corta, particolarmente versatile, che si presta a diversi usi in cucina e può essere ..."
M,Maccheroni,"Maccheroni, caratteristiche principali
Con il termine maccheroni, si indica un formato di pasta corta realizzata attraverso un impasto ..."
M,Macis in polvere,"Conosciuto anche con il nome di “fiore della noce moscata”, il macis è una spezia indonesiana. Ha un sapore delicato e si utilizza per ..."
M,Madera,"Madera, proprietà principali
Il Madera è un vino liquoroso con origini portoghesi nato a Madera, arcipelago di isole vulcaniche situato ..."
M,Mafaldine,"Mafaldine, caratteristiche principali
Le mafaldine, dette anche mafalde o reginette, sono un tipo di pasta realizzata con acqua e con ..."
M,Maggiorana,"Maggiorana, proprietà principali
La maggiorana è un’erba aromatica che appartiene alla stessa famiglia dell’origano – ma con odore meno ..."
M,Maiale,"Maiale, proprietà principali
Dato che gli animali scelti per la macellazione sono estremamente meno grassi di quelli usati in passato, ..."
M,Maialino da latte,"Maialino da latte, proprietà principali
Il maialino da latte è un ingrediente che è caratterizzato da una carne bianca molto tenera e ..."
M,Maionese,"La maionese è una salsa gustosa, molto versatile in cucina. Si può comprare già pronta al supermercato oppure preparare a casa con ..."
M,Mais,"Mais, proprietà principali
Originario del Messico e diffuso in Europa dopo la scoperta dell’America, il mais – noto anche come ..."
M,Maltagliati,"I maltagliati, anche chiamati puntarine, sono una pasta tipica dell’Emilia Romagna ricavata dalle rimanenze delle tagliatelle, ..."
M,Malto,"Il malto è un prodotto di origine vegetale, nello specifico un derivato dei cereali: di solito viene impiegato nella produzione di ..."
M,Malto tostato,"Il malto tostato è un ingrediente fondamentale per la panificazione, in particolar modo nei prodotti da forno come pane di segale, pane ..."
M,Malvasia,"Con il nome Malvasia vengono indicati molti vitigni, la maggior parte a bacca bianca, geograficamente distribuiti un po’ in tutta ..."
M,Mandaranci,"I mandaranci sono frutti ibridi fra il mandarino e l’arancio. Originari dell’Asia, questi frutti sono diffusi in tutto il mondo, dove ..."
M,Mandarini,"Mandarini, proprietà principali
Con il cedro e il pomelo, il mandarino è il terzo agrume originale da cui ne derivano altri come ..."
M,Mandarino cinese (kumquat),"Mandarino cinese (kumquat), proprietà principali
Il kumquat, noto anche come mandarino cinese o fortunella, è un agrume dalle piccole ..."
M,Mandorle,"Mandorle, proprietà principali
Originario dell’Asia, il mandorlo si è diffuso in tutti i Paesi dell’area mediterranea dove fiorisce ad ..."
M,Mandorle pelate,"Le mandorle pelate sono mandorle private della pellicina che le ricopre. Questi semi oleosi ricchi di benefici e dal gusto delicato, ..."
M,Mandorle sgusciate,"Praticamente immancabili in ogni dispensa, le mandorle possono essere usate sia con o senza buccia. Quelle sgusciate (che si ..."
M,Mandorle tostate a lamelle,"Mandorle tostate a lamelle, caratteristiche principali
Con mandorle tostate a lamelle si indicano le mandorle sottoposte a tostatura ..."
M,Mango,"Mango, proprietà principali
Originario dell’Asia, il mango è una pianta sempreverde molto alta della stessa famiglia del pistacchio che ..."
M,Manioca,"La manioca è una radice di origini sudamericane, usata in particolare in Brasile. È nota anche come cassava o yuca ed è la terza fonte ..."
M,Manzo,"Il manzo è probabilmente uno degli animali più consumati in cucina, non solo per il sapore straordinario e le importanti qualità ..."
M,Maracuja,"La maracuja è una bacca commestibile della Passiflora edulis, pianta che appartiene alla famiglia delle Passifloracee ed è originaria ..."
M,Marasche,"Le marasche sono frutti molto simili alle comuni ciliegie, ma con importanti differenze da un punto di vista botanico. Le ciliegie sono ..."
M,Maraschino,"Il maraschino è un liquore dolce e fruttato, dall’aroma e dal gusto inconfondibili, originario della Dalmazia , e più precisamente di ..."
M,Margarina,"Margarina, proprietà principali
La margarina è un grasso alimentare nato dall’emulsione di acqua e grassi alimentari di origine animale ..."
M,Maritozzo,"Il maritozzo è un dolce tipico della tradizione romana, lo si fa risalire addirittura all’Antica Roma. Diffuso nel Centro Italia, ha la ..."
M,Marmellata di albicocche,"La marmellata è un alimento conosciuto in tutto il mondo e molto amato in Italia, sia dai grandi che dai piccini. Accompagna in genere ..."
M,Marmellata di amarene,"Marmellata di amarene, proprietà principali
La marmellata di amarene è una delle conserve più consumate e preparate in casa da ..."
M,Marmellata di arance,"Per conservare il gusto unico delle succose arance durante tutto l’anno, si può preparare una squisita marmellata di arance, da ..."
M,Marmellata di cachi,"Marmellata di cachi, proprietà principale
La marmellata di cachi è una conserva ricavata dalla polpa di uno dei frutti autunnali più ..."
M,Marmellata di ciliegie,Dal ciliegio nascono i frutti più buoni e dolci che portiamo in tavola e che consumiamo durante l’estate. Gli stessi che ci permettono ...
M,Marmellata di fichi,"Marmellata di fichi, caratteristiche principali
La marmellata di fichi è tra le più gustose in circolazione. Può essere preparata con ..."
M,Marmellata di fragole,"Una delizia che ci riporta all’infanzia, una ghiottoneria da gustare in qualsiasi momento della giornata: la marmellata di fragole è ..."
M,Marmellata di lamponi,"La marmellata di lamponi è un ingrediente dolce, con una nota acidula, perfetto per preparare tante ricette dolci. Questo alimento ..."
M,Marmellata di limoni,"Marmellata di limoni, proprietà principali
La marmellata di limoni è una confettura dal sapore fresco e molto profumata, ottima per ..."
M,Marmellata di mele,"La marmellata è un alimento molto amato da grandi e piccini, ottimo a colazione, a merenda o parte di un dessert a fine pasto. Ne ..."
M,Marmellata di mele cotogne,"La marmellata di mele cotogne, detta anche cotognata, è una conserva alimentare prodotta a partire dalla mela cotogna, frutto definito ..."
M,Marmellata di mirtilli,La marmellata di mirtilli è una preparazione che esalta al massimo le proprietà e la bontà dei mirtilli. Si può preparare sia con ...
M,Marmellata di pesche,"La marmellata di pesche è una vera delizia, la si può spalmare sul pane, sulle fette biscottate, può essere il ripieno dei cornetti o ..."
M,Marmellata di rabarbaro,Il rabarbaro è una pianta molto versatile e dai molteplici utilizzi in cucina: uno di questi è la sua trasformazione in ...
M,Marmellata di ribes,"La marmellata di ribes viene preparata con le bacche dal caratteristico sapore dolce-acidulo ricavate dalla pianta omonima, che possono ..."
M,Marmellata di uva,"I frutti della terra, se debitamente impiegati, possono trasformarsi in ingredienti preziosi per alcune delle preparazioni più squisite ..."
M,Marron glaces,"I marron glaces sono una lavorazione di pasticceria della castagna, alimento tipicamente autunnale: il nome francese che li definisce ..."
M,Marroni,"I marroni sono i frutti degli alberi coltivati di castagne e sono utilizzati e apprezzati in cucina sia per l’alto valore nutrizionale, ..."
M,Marsala,"Il Marsala è un vino liquoroso DOC prodotto in Sicilia, non solo a Marsala ma in quasi tutta la provincia di Trapani. Viene bevuto ..."
M,Marshmallow,"Marshmallow, proprietà principali
I marshmallow sono dei dolcetti di zucchero a forma di piccoli cilindri. Quelli oggi comunemente in ..."
M,Martini Extra Dry,"Il Martini Extra Dry è un vermouth, ovvero un vino aromatizzato e liquoroso che presenta una gradazione alcolica superiore a quella di ..."
M,Martini Rosato,"Il Martini rosato è un vino da aperitivo. Il suo gusto caratteristico è dato dalla presenza dei chiodi di garofano, della noce moscata ..."
M,Marzapane,"Il marzapane è una pasta dolce preparata con albume d’uovo oppure miele, zucchero e mandorle sminuzzate. Il risultato è un impasto ..."
M,Mascarpone,"Mascarpone, proprietà principali
Il mascarpone è un latticino di origine lombarda ricavato dalla lavorazione della panna, che si ..."
M,Mastice di Chios,"Il Mastice di Chios è una resina ricavata dall’arbusto lentisco, un sempreverde della famiglia delle Anacardiaceae che viene coltivato ..."
M,Mazzancolle,"Mazzancolle, proprietà principali
Caratteristiche del Mediterraneo, le mazzancolle – conosciute anche come gamberi imperiali – sono ..."
M,Melagrana,"Melagrana, proprietà principali
Originaria dell’Asia sud-occidentale, il melograno viene attualmente coltivato in Iran, Turchia, India, ..."
M,Melanzane,"Melanzane, proprietà principali
La melanzana è una pianta erbacea estiva appartiene alla famiglia delle solanacee esattamente come il ..."
M,Melassa,"La melassa è un liquido bruno, per certi versi simile al miele, che si ottiene in seguito alla centrifugazione dello zucchero. Ha una ..."
M,Mele Evelina,"Disponibili praticamente tutto l’anno e amate da grandi e piccini, le mele sono il frutto per eccellenza. Ve ne sono tantissime ..."
M,Mele Fuji,"Mala Fuji, proprietà principali
La mela Fuji è la varietà di mele più coltivata al mondo, nata dall’incrocio della Red Delicious e ..."
M,Mele Golden Delicious,"Mele Golden Delicious, proprietà principali
Le Mele Golden Delicious sono un particolare tipo di mela dal sapore unico. Questa varietà ..."
M,Mele Granny Smith,"Le mele Granny Smith sono una varietà di mela verde. Famosissime e apprezzate in tutto il mondo, hanno un colore intenso, una polpa ..."
M,Mele Pink Lady,"Le mele sono forse il tipo di frutto più diffuso sulle nostre tavole, presente ormai in qualsiasi stagione dell’anno e dal sapore amato ..."
M,Mele Red Delicious,"Le mele Red Delicious sono una varietà caratterizzata dal colore rosso scuro, dalla forma allungata e dalla consistenza particolarmente ..."
M,Mele Royal Gala,"Tra le varietà di mele più famose in Italia, troviamo le mele Royal Gala: si tratta di un frutto dalla lunga storia, che viene ..."
M,Mele cotogne,"Le mele cotogne sono una varietà di mela derivante dall’albero cotogno, e appartengono alla famiglia delle pomacee. Il cotogno è ..."
M,Mele renette,"Questa particolare varietà di mele unisce gusto e salute, è perfetta in cucina, buona sia cruda che cotta, ma anche per realizzare e ..."
M,Mele secche,"Mele secche, proprietà principali
Le mele secche sono note anche come chips di mele o mele disidratate. Si ottengono dalla ..."
M,Melissa,La melissa è una pianta dalle incredibili virtù particolarmente apprezzata in cucina per il sapore e per le proprietà variegate che la ...
M,Melone,"Melone, proprietà principali
Il melone è una pianta rampicante della famiglia delle cucurbitacee, come la zucca, la zucchina, il ..."
M,Melone giallo invernale,"Melone giallo invernale, caratteristiche principali
Il melone giallo invernale, o semplicemente melone giallo, è un ortaggio che viene ..."
M,Menta,"Menta, proprietà principali
La menta è un’erba aromatica diffusa sia in Europa che in Asia e in Africa, poiché tollera bene sia il ..."
M,Mentuccia,"È un ingrediente straordinario, un vero e proprio alleato della nostra salute, stiamo parlando della mentuccia, una pianta erbacea ..."
M,Meringhe,"Meringhe, caratteristiche principali
Le meringhe sono una preparazione base in pasticceria. Dolcissime, sono composte in gran parte da ..."
M,Merlano,"Il merlano è un pesce conosciuto anche con il nome di molo, e fa parte della famiglia Gadidae. In natura, frequenta acque fredde e ..."
M,Merluzzo (nasello),"Merluzzo (nasello), proprietà principali
Con i termini generici merluzzo e nasello si indica talvolta la stessa tipologia di pesce, ..."
M,Merluzzo neozelandese (hoki),"Il merluzzo neozelandese, conosciuto anche come hoki, è una specie ittica che proviene dalla Nuova Zelanda e ricavato dalla pesca nelle ..."
M,Mezze maniche rigate,"Le mezze maniche rigate sono un formato di pasta molto particolare e apprezzato. Il nome, così originale, è legato agli abiti che si ..."
